state_name,lga_name,ward_name,name,pu_code,document.url,has_old_documents
IMO,ORSU (AWO IDEMILI),EZIAWA,COMM. SCH. II EZIAWA I,16/22/10/002,,false
IMO,ORSU (AWO IDEMILI),EZIAWA,COMM. SCH. I  EZIAWA II,16/22/10/007,,false
IMO,ORSU (AWO IDEMILI),EZIAWA,COMP. SEC. SCHOOL EZIAWA,16/22/10/001,,false
IMO,ORSU (AWO IDEMILI),EZIAWA,COMM. SCH. I  EZIAWA I,16/22/10/006,,false
IMO,ORSU (AWO IDEMILI),EZIAWA,COMM. SCH. III EZIAWA II,16/22/10/005,,false
IMO,ORSU (AWO IDEMILI),EZIAWA,COMM. SCH. II EZIAWA II,16/22/10/003,,false
IMO,ORSU (AWO IDEMILI),EZIAWA,COMM. SCH. III EZIAWA I,16/22/10/004,,false
IMO,ORSU (AWO IDEMILI),EZIAWA,UVDC HALL AMAIKPO URUALA EZIAWA,16/22/10/008,,false