state_name,lga_name,ward_name,name,pu_code,document.url,has_old_documents
KOGI,YAGBA EAST,MAKUTU II,"OKEGADA, OPP. OLD IST BANK PLC BUILDING ISANLU",22/20/08/002,https://docs.inecelectionresults.net/elections_prod/1292/state/01/lga/20/ward/08/pu/002/002-1677412541.pdf,false
KOGI,YAGBA EAST,MAKUTU II,"INFRONT OF ST. KIZITO COLLEGE GATE, OKE-BUKUN, MAKUTU II",22/20/08/009,https://docs.inecelectionresults.net/elections_prod/1292/state/01/lga/20/ward/08/pu/009/009-1677411726.pdf,false
KOGI,YAGBA EAST,MAKUTU II,"TIPPER GARAGE OPP. ST. JOSEPH AFRICAN CHURCH, MAKUTU",22/20/08/008,https://docs.inecelectionresults.net/elections_prod/1292/state/01/lga/20/ward/08/pu/008/008-1677410990.pdf,false
KOGI,YAGBA EAST,MAKUTU II,"CENTRAL NURTW GARAGE MAKUTU II, ISANLU",22/20/08/007,https://docs.inecelectionresults.net/elections_prod/1292/state/01/lga/20/ward/08/pu/007/007-1677410375.pdf,false
KOGI,YAGBA EAST,MAKUTU II,"GOVERNMENT LODGE JUNCTION, MAKUTU II",22/20/08/006,https://docs.inecelectionresults.net/elections_prod/1292/state/01/lga/20/ward/08/pu/006/006-1677409765.pdf,false
KOGI,YAGBA EAST,MAKUTU II,"CHRISTIAN YOUTH CENTRE JUNCTION, MAKUTU II",22/20/08/005,https://docs.inecelectionresults.net/elections_prod/1292/state/01/lga/20/ward/08/pu/005/005-1677409046.pdf,false
KOGI,YAGBA EAST,MAKUTU II,ITEDO-OBA II NEAR ST. KIZITO'S COLLEGE JUNCTION,22/20/08/004,https://docs.inecelectionresults.net/elections_prod/1292/state/01/lga/20/ward/08/pu/004/004-1677408320.pdf,false
KOGI,YAGBA EAST,MAKUTU II,"AIYETORO ITEDO, UPPER AREA COURT AREA",22/20/08/003,https://docs.inecelectionresults.net/elections_prod/1292/state/01/lga/20/ward/08/pu/003/003-1677407462.pdf,false
KOGI,YAGBA EAST,MAKUTU II,"ITEDO-OBA, OPP. ST. KIZITO'S COLLEGE ROAD RCM/ST. JOSEPH PRIMARY SCHOOL OLD SITE",22/20/08/001,https://docs.inecelectionresults.net/elections_prod/1292/state/01/lga/20/ward/08/pu/001/001-1677406389.pdf,false