state_name,lga_name,ward_name,name,pu_code,document.url,has_old_documents
DELTA,ISOKO SOUTH,,"OPEN SPACE BY EWOKPOKPO STREET/ENUTO QTRS, EMEDE",10/10/05/028,https://inec-cvr-cache.s3.eu-west-1.amazonaws.com/cached/results/629480/result_146179_1677683071_thumb.jpg,false
DELTA,ISOKO SOUTH,,"OPEN SPACE-OVIE OTULOHO STR./ENUTO QTR, EMEDE",10/10/05/027,https://inec-cvr-cache.s3.eu-west-1.amazonaws.com/cached/results/629479/result_146178_1677682975_thumb.jpg,false
DELTA,ISOKO SOUTH,,"OPEN SPACE-OVIE /OKPAUKU ST./ADAZA QTR, EMEDE",10/10/05/026,https://inec-cvr-cache.s3.eu-west-1.amazonaws.com/cached/results/629478/result_146177_1677682822_thumb.jpg,false
DELTA,ISOKO SOUTH,,"ODORO STREET, IGBOBA HALL/URUARA QUARTERS, EMEDE",10/10/05/024,https://inec-cvr-cache.s3.eu-west-1.amazonaws.com/cached/results/629476/result_146175_1677682388_thumb.jpg,false
DELTA,ISOKO SOUTH,,"OPEN SPACE/EGBUWOKU ROAD BY AHAMEA LAYOUT, EMEDE",10/10/05/023,https://inec-cvr-cache.s3.eu-west-1.amazonaws.com,false
DELTA,ISOKO SOUTH,,"OPEN SPACE/URUORIOKPO STREET ETEVIE QTRS, EMEDE",10/10/05/022,https://inec-cvr-cache.s3.eu-west-1.amazonaws.com/cached/results/629474/result_146173_1677682167_thumb.jpg,false
DELTA,ISOKO SOUTH,,"OPEN SPACE/EWERI ROAD, BY URUOVO STREET ADAZA QTR, EMEDE",10/10/05/021,https://inec-cvr-cache.s3.eu-west-1.amazonaws.com/cached/results/629473/result_146172_1677682078_thumb.jpg,false
DELTA,ISOKO SOUTH,,"URUEDHO HALL  BY ADAZA QUARTERS, EMEDE",10/10/05/020,https://inec-cvr-cache.s3.eu-west-1.amazonaws.com/cached/results/629472/result_146171_1677682000_thumb.jpg,false
DELTA,ISOKO SOUTH,,"URUONWO HALL /ADAZA QUARTERS, EMEDE",10/10/05/019,https://inec-cvr-cache.s3.eu-west-1.amazonaws.com/cached/results/629471/result_146170_1677681922_thumb.jpg,false
DELTA,ISOKO SOUTH,,"URIE PRIMARY SCHOOL QUARTERS, EMEDE",10/10/05/018,https://inec-cvr-cache.s3.eu-west-1.amazonaws.com/cached/results/629470/result_146169_1677681511_thumb.jpg,false
DELTA,ISOKO SOUTH,,ODHIGBO HALL OKPRO QUARTERS,10/10/05/017,https://inec-cvr-cache.s3.eu-west-1.amazonaws.com/cached/results/629469/result_146168_1677681438_thumb.jpg,false
DELTA,ISOKO SOUTH,,"UYARO HALL, OKPRO QUARTER EMEDE.",10/10/05/016,https://inec-cvr-cache.s3.eu-west-1.amazonaws.com/cached/results/629468/result_146167_1677681364_thumb.jpg,false
DELTA,ISOKO SOUTH,,"OPEN SPACE UBIOFO STREET, ODHE QTRS. EMEDE",10/10/05/015,https://inec-cvr-cache.s3.eu-west-1.amazonaws.com/cached/results/629467/result_146166_1677681258_thumb.jpg,false
DELTA,ISOKO SOUTH,,"ORO HALL, ENUTO QUARTERS, EMEDE",10/10/05/014,https://inec-cvr-cache.s3.eu-west-1.amazonaws.com/cached/results/629466/result_146165_1677681118_thumb.jpg,false
DELTA,ISOKO SOUTH,,"ENUTO/IKOYI  HALL, ENUTO QUARTERS",10/10/05/012,https://inec-cvr-cache.s3.eu-west-1.amazonaws.com/cached/results/30036/result_146163_1677680971_thumb.jpg,false
DELTA,ISOKO SOUTH,,"URI JAKA  HALL, URUAKA, OKROMORO",10/10/05/011,https://inec-cvr-cache.s3.eu-west-1.amazonaws.com/cached/results/30035/result_146162_1677680825_thumb.jpg,false
DELTA,ISOKO SOUTH,,"EWEOKPE  HALL, URUAKA, OKROMORO",10/10/05/010,https://inec-cvr-cache.s3.eu-west-1.amazonaws.com,false
DELTA,ISOKO SOUTH,,"OKPAKPAJE  HALL, URUAKA, OKROMORO",10/10/05/009,https://inec-cvr-cache.s3.eu-west-1.amazonaws.com/cached/results/30033/result_146160_1677680626_thumb.jpg,false
DELTA,ISOKO SOUTH,,"OKROMORO HALL, URUAKA, OKROMORO",10/10/05/008,https://inec-cvr-cache.s3.eu-west-1.amazonaws.com/cached/results/30032/result_146159_1677680531_thumb.jpg,false
DELTA,ISOKO SOUTH,,"ETEVIE HALL,  OKPOHRO/ADAZA/ETEVIE",10/10/05/007,https://inec-cvr-cache.s3.eu-west-1.amazonaws.com/cached/results/30031/result_146158_1677680377_thumb.jpg,false
DELTA,ISOKO SOUTH,,"EWERI PRIMARY SCHOOL, OKPOHRO/ADAZA/ETEVIE",10/10/05/006,https://inec-cvr-cache.s3.eu-west-1.amazonaws.com/cached/results/30030/result_146157_1677680275_thumb.jpg,false
DELTA,ISOKO SOUTH,,"URUOHO HALL, ENUTO QUARTERS I",10/10/05/001,https://inec-cvr-cache.s3.eu-west-1.amazonaws.com/cached/results/30025/result_146152_1677679313_thumb.jpg,false
DELTA,ISOKO SOUTH,,"ORUOKPHRO HALL, OKPOHRO/ADAZA/ETEVIE II",10/10/05/004,,false
DELTA,ISOKO SOUTH,,"ORUOKPHRO HALL, OKPOHRO/ADAZA/ETEVIE I",10/10/05/003,,false
DELTA,ISOKO SOUTH,,"URUOHO HALL, ENUTO QUARTERS II",10/10/05/013,,false
DELTA,ISOKO SOUTH,,"URUAKA  HALL, OKPOHRO/ADAZA/ETEVIE",10/10/05/005,,false
DELTA,ISOKO SOUTH,,"ODHE HALL, ENUTO QUARTERS",10/10/05/002,,false
DELTA,ISOKO SOUTH,,"EMEDE GRAMMAR SCHOOL, EMEDE.",10/10/05/025,,false