state_name,lga_name,ward_name,name,pu_code,document.url,has_old_documents
AKWA IBOM,IBIONO IBOM,IKPANYA,"VILLAGE SQUARE, ABURU",03/10/11/005,,false
AKWA IBOM,IBIONO IBOM,IKPANYA,"VILLAGE SQUARE, MBAK UNO",03/10/11/002,,false
AKWA IBOM,IBIONO IBOM,IKPANYA,"VILLAGE HALL, AKANI OBIO",03/10/11/004,,false
AKWA IBOM,IBIONO IBOM,IKPANYA,"PRY SCH, ESIT IKPANYA",03/10/11/003,,false
AKWA IBOM,IBIONO IBOM,IKPANYA,"VILLAGE SQUARE, IKOT ADAHA",03/10/11/001,,false
AKWA IBOM,IBIONO IBOM,IKPANYA,"VILLAGE SQUARE, ESIT IKPANYA CLAN",03/10/11/006,,false