state_name,lga_name,ward_name,name,pu_code,document.url,has_old_documents
DELTA,ETHIOPE  EAST,,FRONT OF SOHWO'S GATE EKREBUO,10/05/11/007,,false
DELTA,ETHIOPE  EAST,,"FRONT OF LOCAL GOVERNMENT COUNCIL, ISIOKOLO",10/05/11/005,,false
DELTA,ETHIOPE  EAST,,OPEN SPACE BY UKUDJAVWERI JUNCTION,10/05/11/009,,false
DELTA,ETHIOPE  EAST,,"FRONT OF AMAGRE  GATE, EKREBUO",10/05/11/006,,false
DELTA,ETHIOPE  EAST,,OPEN SPACE BY ISIOKOLO MARKET SQUARE,10/05/11/008,,false
DELTA,ETHIOPE  EAST,,"OLD POLICE STATION, ISIOKOLO",10/05/11/002,,false
DELTA,ETHIOPE  EAST,,"FRONT OF EJOMAFUVWE'S COMPOUND, URHUODE QTRS., ISIOKOLO",10/05/11/004,,false
DELTA,ETHIOPE  EAST,,"FRONT OF OBOH'S COMPOUND, ISIOKOLO",10/05/11/001,,false
DELTA,ETHIOPE  EAST,,"AGBON PRIM. SCH., ISIOKOLO",10/05/11/003,,false