state_name,lga_name,ward_name,name,pu_code,document.url,has_old_documents
ONDO,ONDO EAST,ASANTAN OJA,"ASANTAN FIIBE, L.A PRY SCH ASANTAN FIIBE",28/15/02/002,https://inec-cvr-cache.s3.eu-west-1.amazonaws.com/cached/results/95289/result_84088_1677495681_thumb.jpg,true
ONDO,ONDO EAST,ASANTAN OJA,"ASANTAN OJA/ASANTAN VILLAGE MOFERERE, ST DAVID PRY SCH ASANTAN, OJA",28/15/02/001,https://inec-cvr-cache.s3.eu-west-1.amazonaws.com/cached/results/95288/result_84087_1677495654_thumb.jpg,true
ONDO,ONDO EAST,ASANTAN OJA,"APATA AJE, OPEN SPACE AT APATA AJE",28/15/02/003,https://inec-cvr-cache.s3.eu-west-1.amazonaws.com/cached/results/95290/result_84089_1677495922_thumb.jpg,true
ONDO,ONDO EAST,ASANTAN OJA,"OPEN SPACE AT OKE OJA ROAD, ASATAN OJA",28/15/02/005,https://docs.inecelectionresults.net/elections_prod/1292/state/01/lga/15/ward/02/pu/005/005-1677388332.pdf,false
ONDO,ONDO EAST,ASANTAN OJA,"ORISUNMIBARE/OKE-OYA, L.A PRY SCH, OKE-OYA",28/15/02/004,https://docs.inecelectionresults.net/elections_prod/1292/state/01/lga/15/ward/02/pu/004/004-1677387419.pdf,false