state_name,lga_name,ward_name,name,pu_code,document.url,has_old_documents
ADAMAWA,MUBI NORTH,DIGIL,BATANDE/ BATANDE,02/14/03/001,,false
ADAMAWA,MUBI NORTH,DIGIL,KOFAR JAURO YAZA/ YAZA,02/14/03/006,,false
ADAMAWA,MUBI NORTH,DIGIL,KASUWAN DIGIL OPEN SPACE,02/14/03/011,,false
ADAMAWA,MUBI NORTH,DIGIL,DIGIL PRI. SCH./ LESSWURO,02/14/03/003,,false
ADAMAWA,MUBI NORTH,DIGIL,WURO BARKA/ WURO BARKA,02/14/03/008,,false
ADAMAWA,MUBI NORTH,DIGIL,DIDIF PRI. SCH./ DIDIF,02/14/03/002,,false
ADAMAWA,MUBI NORTH,DIGIL,MUCHALARE/ MUCHALARE,02/14/03/007,,false
ADAMAWA,MUBI NORTH,DIGIL,SABON GARI TRANSFORMER NEAR BORE HOLE,02/14/03/012,,false
ADAMAWA,MUBI NORTH,DIGIL,KOFAR ARDO MARAFA/ DOUWURO,02/14/03/005,,false
ADAMAWA,MUBI NORTH,DIGIL,HURIDA PRI. SCH./ HURIDA I,02/14/03/010,,false
ADAMAWA,MUBI NORTH,DIGIL,HURIDA PRI. SCH./ HURIDA,02/14/03/004,,false
ADAMAWA,MUBI NORTH,DIGIL,WURO HARDE PRI. SCH./ WURO HARDE,02/14/03/009,,false