state_name,lga_name,ward_name,name,pu_code,document.url,has_old_documents
DELTA,ISOKO NORTH,,"NO., 60 IYEVORI STREET, URUDE, OZORO",10/09/11/001,,false
DELTA,ISOKO NORTH,,"IYEOKRA  STREET,  URUDE, OZORO",10/09/11/006,,false
DELTA,ISOKO NORTH,,"EGBURURIE PRIMARY SCHOOL ORUAMUDHU, OZORO",10/09/11/011,,false
DELTA,ISOKO NORTH,,"OPEN SPACE, IYERIRI STREET II",10/09/11/017,,false
DELTA,ISOKO NORTH,,"OPEN SPACE, EBO STREET JUNCTION",10/09/11/022,,false
DELTA,ISOKO NORTH,,ENAPIE HALL,10/09/11/027,,false
DELTA,ISOKO NORTH,,"OPEN SPACE, OSIOBOR STREET",10/09/11/032,,false
DELTA,ISOKO NORTH,,"OZADHE STREET,  URUDE, OZORO",10/09/11/004,,false
DELTA,ISOKO NORTH,,"OFAH HALL  ORUAMUDHU, OZORO",10/09/11/009,,false
DELTA,ISOKO NORTH,,"OPEN SPACE, EMESE  STREET JUNCTION",10/09/11/015,,false
DELTA,ISOKO NORTH,,"OPEN SPACE, ODHEGBA STREET",10/09/11/020,,false
DELTA,ISOKO NORTH,,"OPEN SPACE, URUIGO STREET",10/09/11/025,,false
DELTA,ISOKO NORTH,,"OPEN SPACE, OZARIGHE AVENUE",10/09/11/030,,false
DELTA,ISOKO NORTH,,"OPEN SPACE, ALUA STREET",10/09/11/013,,false
DELTA,ISOKO NORTH,,"NO. 9 IYERIRI STREET,  URUDE, OZORO",10/09/11/003,,false
DELTA,ISOKO NORTH,,"NO. 18 OPRE STREET, ORUAMUDHU, OZORO",10/09/11/008,,false
DELTA,ISOKO NORTH,,"OPEN SPACE, EGWEDHE STREET JUNCTION",10/09/11/014,,false
DELTA,ISOKO NORTH,,"OPEN SPACE, OZADHE STREET II",10/09/11/019,,false
DELTA,ISOKO NORTH,,"OPEN SPACE, ODUEME AVENUE",10/09/11/024,,false
DELTA,ISOKO NORTH,,"OGBAIDE STREET,  URUDE, OZORO",10/09/11/005,,false
DELTA,ISOKO NORTH,,"OPEN SPACE, OBEMU STREET",10/09/11/029,,false
DELTA,ISOKO NORTH,,"IYEGELURU STREET ORUAMUDHU, OZORO",10/09/11/010,,false
DELTA,ISOKO NORTH,,"OPEN SPACE, IGBUDUMA STREET",10/09/11/034,,false
DELTA,ISOKO NORTH,,"JOLLYMAN SHADE, URUDE, OZORO",10/09/11/002,,false
DELTA,ISOKO NORTH,,"OPEN SPACE, AKA ROAD JUNCTION",10/09/11/016,,false
DELTA,ISOKO NORTH,,"ORORO  HOUSE,  URUDE, OZORO",10/09/11/007,,false
DELTA,ISOKO NORTH,,"OPEN SPACE, IYEKOTOR STREET",10/09/11/021,,false
DELTA,ISOKO NORTH,,"UGBULUHU  STREET,  ORUAMUDHU, OZORO",10/09/11/012,,false
DELTA,ISOKO NORTH,,"OPEN SPACE, PARADISE URUOGBA STREET",10/09/11/026,,false
DELTA,ISOKO NORTH,,"OPEN SPACE, IYERIRI STREET III",10/09/11/018,,false
DELTA,ISOKO NORTH,,"OPEN SPACE, AKPOTARENO LANE",10/09/11/031,,false
DELTA,ISOKO NORTH,,"OPEN SPACE, URUOLE STREET",10/09/11/023,,false
DELTA,ISOKO NORTH,,ORUAMUDHU HALL,10/09/11/028,,false
DELTA,ISOKO NORTH,,"OPEN SPACE, OYOYO STREET",10/09/11/033,,false